{
  "sector": "s3_visual_planning",
  "contract_version": "s3.compiled_entities.v1",
  "job_id": "all_ops_cli_001",
  "video_id": "all_ops_cli_001",
  "account_id": "006",
  "language": "pt-BR",
  "status": "completed",
  "entity_focus": {
    "priority_mode": "strict_precision",
    "coverage_mode": "balanced"
  },
  "sources": {
    "source_package_path": "C:\\Users\\User-OEM\\.openclaw\\workspace\\content_factory_block2\\runtime_realcheck\\run_012\\b2\\sectors\\s3_visual_planning\\inputs\\s3_source_package.json"
  },
  "operators": {
    "human_subject_extractor": {
      "status": "completed",
      "output_path": "C:\\Users\\User-OEM\\.openclaw\\workspace\\content_factory_block2\\runtime_realcheck\\run_012\\b2\\sectors\\s3_visual_planning\\operators\\human_subject_extractor\\output.json"
    },
    "environment_location_extractor": {
      "status": "completed",
      "output_path": "C:\\Users\\User-OEM\\.openclaw\\workspace\\content_factory_block2\\runtime_realcheck\\run_012\\b2\\sectors\\s3_visual_planning\\operators\\environment_location_extractor\\output.json"
    },
    "object_artifact_extractor": {
      "status": "completed",
      "output_path": "C:\\Users\\User-OEM\\.openclaw\\workspace\\content_factory_block2\\runtime_realcheck\\run_012\\b2\\sectors\\s3_visual_planning\\operators\\object_artifact_extractor\\output.json"
    },
    "symbolic_event_extractor": {
      "status": "completed",
      "output_path": "C:\\Users\\User-OEM\\.openclaw\\workspace\\content_factory_block2\\runtime_realcheck\\run_012\\b2\\sectors\\s3_visual_planning\\operators\\symbolic_event_extractor\\output.json"
    }
  },
  "compiled_entities": {
    "human_subjects": [
      {
        "entity_id": "h1",
        "entity_type": "person",
        "canonical_label": "king",
        "scene_ids": ["scene_001"],
        "visual_relevance_note": "main figure"
      }
    ],
    "environment_locations": [
      {
        "location_id": "loc_001",
        "name": "palace",
        "type": "interior",
        "confidence": 0.98,
        "scene_refs": ["scene_001"],
        "attributes": ["royal", "architectural", "formal"]
      },
      {
        "location_id": "loc_002",
        "name": "city",
        "type": "urban_exterior",
        "confidence": 0.97,
        "scene_refs": ["scene_002"],
        "attributes": ["urban", "open_air", "ceremonial"]
      }
    ],
    "object_artifacts": [
      {
        "entity_id": "o1",
        "entity_type": "artifact",
        "canonical_label": "crown",
        "scene_ids": ["scene_001"],
        "specificity": "specific",
        "visual_relevance_note": "Royal headpiece worn by the king; a primary visible prop in the opening scene."
      },
      {
        "entity_id": "o2",
        "entity_type": "prop",
        "canonical_label": "banners",
        "scene_ids": ["scene_002"],
        "specificity": "general",
        "visual_relevance_note": "Large civic or ceremonial banners wave over the city during the storm scene."
      }
    ],
    "symbolic_events": [
      {
        "event_id": "sym_001",
        "name": "royal entrance",
        "type": "symbolic_action",
        "confidence": 0.96,
        "scene_refs": ["scene_001"],
        "interpretation": "authority and legitimacy entering a formal royal space"
      },
      {
        "event_id": "sym_002",
        "name": "storm over the city",
        "type": "atmospheric_phenomenon",
        "confidence": 0.97,
        "scene_refs": ["scene_002"],
        "interpretation": "dramatic tension over a public urban setting"
      }
    ]
  },
  "compile_notes": [],
  "warnings": [],
  "generated_at": "2026-04-03T17:40:00Z"
}